key,en,th
role,Developer | Programming & Creative Tools,นักพัฒนา | การเขียนโปรแกรมและเครื่องมือสร้างสรรค์
aboutMeTitle,About Me,เกี่ยวกับฉัน
aboutMeContent,"Hello, I'm <strong>TamKungZ_</strong>. I work with various programming languages, engines and creative tools.",สวัสดีครับ ผมคือ <strong>TamKungZ_</strong> ทำงานกับภาษาการเขียนโปรแกรม เอนจิ้น และ การออกแบบกราฟิก
skillsTitle,Skills & Tools,ทักษะและเครื่องมือ
skillsLanguages,Languages & Scripting:,ภาษาและสคริปต์:
skillsEngines,Game Engines:,เอนจิ้นเกม:
skillsArt,Art & Design:,ศิลปะและการออกแบบ:
skillsAudio,Audio & Video:,เสียงและวิดีโอ:
skillsOther,Other Tools:,เครื่องมืออื่น ๆ:
